{
  "name": "auto-pilot",
  "version": "0.8.9",
  "description": "Unified automated AI coding system: autonomous PM-Worker-Reviewer loop (Opus PM, parallel Sonnet workers, phase gates) \u00b7 dual adversarial review (Codex + cold Claude until both APPROVE) \u00b7 quality lift (13-dim big-tech rubric) \u00b7 harness bootstrap (setup-harness) \u00b7 graphify-native doc management (doc-management \u2014 REBUILD/MAINTAIN/AUDIT keeps docs matching code) \u00b7 swarm tmux parallel execution backend \u00b7 SHA-pin deploy standard \u00b7 codex conductor mode \u00b7 vault export (Obsidian/NotebookLM) \u00b7 goal intake + retro agents. Full auto, no confirms.",
  "author": {
    "name": "lyan",
    "email": "art5@fyqro.com"
  },
  "keywords": [
    "autonomous",
    "pm-worker",
    "adversarial-review",
    "dual-review",
    "codex",
    "sonnet-1m",
    "opus-4.7",
    "self-driving",
    "phase-gate",
    "doc-management",
    "graphify",
    "swarm",
    "tmux",
    "sha-deploy",
    "harness",
    "obsidian",
    "notebooklm"
  ]
}
